{
  "$schema": "ai/schemas/command-result.schema.json",
  "$id": "ai/fixtures/phase-1a/valid/command-result-blocked.json",
  "schemaVersion": 1,
  "runId": "fixture-run-blocked",
  "commandId": "verify.api-smoke",
  "startedAt": "2026-07-10T10:00:00Z",
  "endedAt": "2026-07-10T10:00:00Z",
  "result": "BLOCKED",
  "processExitCode": null,
  "argvHash": null,
  "inputFingerprint": null,
  "environmentFingerprint": null,
  "stdoutPath": null,
  "stderrPath": null,
  "redactionApplied": false,
  "reason": "Phase 1A blocks non-configured runtime command execution."
}
