{
  "$schema": "ai/schemas/command-result.schema.json",
  "$id": "ai/fixtures/phase-1a/valid/command-result.json",
  "schemaVersion": 1,
  "runId": "fixture-run-001",
  "commandId": "verify.unit",
  "startedAt": "2026-07-10T08:00:00Z",
  "endedAt": "2026-07-10T08:01:00Z",
  "result": "PASS",
  "processExitCode": 0,
  "argvHash": "0000000000000000000000000000000000000000000000000000000000000000",
  "inputFingerprint": "1111111111111111111111111111111111111111111111111111111111111111",
  "environmentFingerprint": "2222222222222222222222222222222222222222222222222222222222222222",
  "stdoutPath": ".ai-runs/fixture-run-001/logs/verify.unit.stdout.log",
  "stderrPath": ".ai-runs/fixture-run-001/logs/verify.unit.stderr.log",
  "redactionApplied": true,
  "reason": null
}
