{
  "$schema": "ai/schemas/command-result.schema.json",
  "$id": ".ai-runs/run-1/commands/verify.prepare/attempt-prepare.json",
  "schemaVersion": 1,
  "runId": "run-1",
  "commandId": "verify.prepare",
  "attemptId": "attempt-prepare",
  "processAttemptRef": ".ai-runs/run-1/process-attempts/verify.prepare/attempt-prepare.json",
  "startedAt": "2026-07-11T03:00:00Z",
  "endedAt": "2026-07-11T03:00:01Z",
  "result": "PASS",
  "processExitCode": 0,
  "argvHash": "aaaaaaaaaaaaaaaaaaaaaaaaaaaaaaaaaaaaaaaaaaaaaaaaaaaaaaaaaaaaaaaa",
  "inputFingerprint": "bbbbbbbbbbbbbbbbbbbbbbbbbbbbbbbbbbbbbbbbbbbbbbbbbbbbbbbbbbbbbbbb",
  "environmentFingerprint": "cccccccccccccccccccccccccccccccccccccccccccccccccccccccccccccccc",
  "stdoutPath": ".ai-runs/run-1/logs/verify.prepare/attempt-prepare.stdout.log",
  "stderrPath": ".ai-runs/run-1/logs/verify.prepare/attempt-prepare.stderr.log",
  "redactionApplied": true,
  "reason": null
}
